{
  "meta": {
    "title": "Очаги земледелия в Америке: центры одомашнивания, даты, пути кукурузы",
    "schema": "schema/agriculture.schema.json",
    "license": "CC BY 4.0",
    "notes": [
      "Годы календарные, отрицательные — до н. э. Даты источников в «лет назад» (cal BP) пересчитаны как 1950 − BP и округлены так же, как в источнике; все они приблизительны (approx).",
      "Пятна очагов и точки на пути кукурузы — схема для карты, а не границы и не координаты стоянок.",
      "Некалиброванные радиоуглеродные даты (например, Dillehay et al. 2007 для Анд) в набор не включены: по правилам конспекта на графиках только калиброванные даты."
    ]
  },
  "centers": [
    {
      "id": "meso",
      "name": "Мезоамерика",
      "crops": [
        "кукуруза",
        "тыква (Cucurbita pepo ssp. pepo, C. argyrosperma)",
        "фасоль обыкновенная"
      ],
      "label": {
        "lon": -104,
        "lat": 15,
        "anchor": "end"
      },
      "blobs": [
        {
          "lon": -99.5,
          "lat": 18.3,
          "radius_km": 380
        },
        {
          "lon": -96.5,
          "lat": 17.2,
          "radius_km": 320
        }
      ],
      "sources": [
        {
          "ref": "pickersgill2007",
          "loc": "разд. «Regions of plant domestication in the Americas»"
        },
        {
          "ref": "matsuoka2002",
          "loc": "аннотация"
        },
        {
          "ref": "piperno2009",
          "loc": "аннотация"
        },
        {
          "ref": "smith2006",
          "loc": "разд. «Squash»"
        },
        {
          "ref": "bitocchi2012",
          "loc": "аннотация"
        }
      ]
    },
    {
      "id": "east",
      "name": "Восток Северной Америки",
      "crops": [
        "тыква (Cucurbita pepo ssp. ovifera)",
        "подсолнечник",
        "Iva annua (англ. marsh elder)",
        "марь (Chenopodium berlandieri)"
      ],
      "label": {
        "lon": -80,
        "lat": 33.5,
        "anchor": "start"
      },
      "blobs": [
        {
          "lon": -88.5,
          "lat": 38.3,
          "radius_km": 420
        },
        {
          "lon": -86.5,
          "lat": 36.5,
          "radius_km": 330
        }
      ],
      "sources": [
        {
          "ref": "pickersgill2007",
          "loc": "разд. «Regions of plant domestication in the Americas»"
        },
        {
          "ref": "smith2006",
          "loc": "аннотация"
        },
        {
          "ref": "smith2009",
          "loc": "аннотация"
        },
        {
          "ref": "mueller2025",
          "loc": "разд. 1–2 и рис. 2",
          "note": "пятна — около «основной области» комплекса на карте Мюллер; схема"
        }
      ]
    },
    {
      "id": "andes",
      "name": "Анды",
      "crops": [
        "картофель",
        "киноа",
        "фасоль обыкновенная",
        "лама",
        "альпака"
      ],
      "label": {
        "lon": -76,
        "lat": -17,
        "anchor": "end"
      },
      "blobs": [
        {
          "lon": -76.0,
          "lat": -10.8,
          "radius_km": 300
        },
        {
          "lon": -73.5,
          "lat": -13.3,
          "radius_km": 290
        },
        {
          "lon": -70.8,
          "lat": -15.6,
          "radius_km": 260
        }
      ],
      "sources": [
        {
          "ref": "pickersgill2007",
          "loc": "разд. «Regions of plant domestication in the Americas»"
        },
        {
          "ref": "spooner2005",
          "loc": "аннотация"
        },
        {
          "ref": "rumold2016",
          "loc": "аннотация"
        },
        {
          "ref": "fan2020",
          "loc": "введение"
        },
        {
          "ref": "bitocchi2012",
          "loc": "аннотация"
        },
        {
          "ref": "smith2009",
          "loc": "разд. «Domesticated C. berlanderi at the Riverton Site»",
          "note": "о киноа"
        }
      ]
    },
    {
      "id": "lowlands",
      "name": "Тропические низменности Южной Америки",
      "crops": [
        "маниок",
        "тыква (Cucurbita maxima)",
        "персиковая пальма",
        "острый перец"
      ],
      "label": {
        "lon": -62,
        "lat": 0.5,
        "anchor": "start"
      },
      "blobs": [
        {
          "lon": -63.5,
          "lat": -13.5,
          "radius_km": 370
        },
        {
          "lon": -62.5,
          "lat": -9.8,
          "radius_km": 310
        }
      ],
      "sources": [
        {
          "ref": "pickersgill2007",
          "loc": "разд. «Regions of plant domestication in the Americas»"
        },
        {
          "ref": "olsen1999",
          "loc": "аннотация"
        },
        {
          "ref": "lombardo2020",
          "loc": "аннотация и введение",
          "note": "дикие предки маниока, тыквы, персиковой пальмы, перца растут на юго-западе Амазонии"
        },
        {
          "ref": "watling2018",
          "loc": "аннотация"
        },
        {
          "ref": "clement2015",
          "loc": "аннотация"
        }
      ],
      "todo": [
        "Пятна показывают только юго-запад Амазонии, откуда в главе есть находки; очаг «тропических низменностей» у Пикерсгилл шире."
      ]
    }
  ],
  "places": [
    {
      "id": "balsas",
      "name": "Долина Бальсас",
      "lon": -99.5,
      "lat": 18.3,
      "precision_km": 150,
      "event": "meso_maize_balsas",
      "note": "Стоянка Шиуатокстла в штате Герреро, у долины Игуала (Ranere et al. 2009); точка условная."
    },
    {
      "id": "central_am",
      "name": "Центральная Америка",
      "lon": -80.5,
      "lat": 8.5,
      "precision_km": 500,
      "event": "south_maize_ca"
    },
    {
      "id": "sw_amazon",
      "name": "Юго-запад Амазонии",
      "lon": -65.0,
      "lat": -13.5,
      "precision_km": 500,
      "event": "south_maize_first"
    },
    {
      "id": "sw_us",
      "name": "Юго-Запад США",
      "lon": -111.0,
      "lat": 32.5,
      "precision_km": 400,
      "event": "sw_maize_first",
      "note": "Ранние стоянки — в Аризоне и на западе Нью-Мексико (Merrill et al. 2009); точка условная. Дата — нижняя граница по находкам, а не время прихода."
    },
    {
      "id": "ozarks",
      "name": "Озарк",
      "lon": -93.0,
      "lat": 36.3,
      "precision_km": 300,
      "event": "east_maize_ozark",
      "note": "Дата — возраст изученных образцов (Ramos-Madrigal et al. 2025), а не время прихода кукурузы."
    },
    {
      "id": "northeast",
      "name": "Северо-восток",
      "lon": -76.0,
      "lat": 43.0,
      "precision_km": 500,
      "event": "east_maize_ne",
      "note": "Как кукуруза попала на северо-восток, неизвестно (Mueller 2025) — к этой точке стрелки нет."
    },
    {
      "id": "cahokia",
      "name": "Кахокия",
      "lon": -90.06,
      "lat": 38.66,
      "precision_km": 30,
      "event": "east_maize_cahokia",
      "note": "Не точка пути: здесь показано, когда кукуруза резко вошла в рацион (Emerson et al. 2020), а не откуда она пришла."
    }
  ],
  "events": [
    {
      "id": "meso_maize_gen",
      "region": "meso",
      "crop": "кукуруза",
      "kind": "domestication",
      "origin": "local",
      "label": "расхождение кукурузы и теосинте по генетическому расчёту: ≈9200 лет назад (95%: 13 100–5700)",
      "time": {
        "from": -11143,
        "to": -3739,
        "dating": "approx",
        "central": -7238
      },
      "evidence": "genetics",
      "sources": [
        {
          "ref": "matsuoka2002",
          "loc": "разд. «Date of the Domestication Event»",
          "note": "9188 BP, 95% 5689–13 093 BP; верхняя граница времени одомашнивания"
        }
      ]
    },
    {
      "id": "meso_maize_balsas",
      "region": "meso",
      "crop": "кукуруза",
      "kind": "first",
      "origin": "local",
      "label": "зёрна кукурузы на тёрочных камнях долины Бальсас — не позже ≈8700 лет назад",
      "time": {
        "from": -6750,
        "to": null,
        "dating": "approx",
        "point": true
      },
      "evidence": "archaeology",
      "sources": [
        {
          "ref": "piperno2009",
          "loc": "аннотация"
        }
      ]
    },
    {
      "id": "meso_cobs",
      "region": "meso",
      "crop": "кукуруза",
      "kind": "milestone",
      "origin": "local",
      "label": "древнейшие початки (Гила-Накиц): мелкие, два ряда зёрен, ≈6250 лет назад",
      "time": {
        "from": -4300,
        "to": null,
        "dating": "approx",
        "point": true
      },
      "evidence": "archaeology",
      "sources": [
        {
          "ref": "kennett2020",
          "loc": "введение"
        },
        {
          "ref": "merrill2009",
          "loc": "разд. «The Introduction of Maize Agriculture»",
          "note": "4280 cal. B.C."
        }
      ]
    },
    {
      "id": "meso_productive",
      "region": "meso",
      "crop": "кукуруза",
      "kind": "milestone",
      "origin": "local",
      "label": "более урожайные сорта (Эль-Хиганте, Гондурас): 4300–2500 лет назад",
      "time": {
        "from": -2350,
        "to": -550,
        "dating": "approx"
      },
      "evidence": "archaeology",
      "sources": [
        {
          "ref": "kistler2020",
          "loc": "аннотация"
        }
      ]
    },
    {
      "id": "meso_staple_belize",
      "region": "meso",
      "crop": "кукуруза",
      "kind": "staple",
      "origin": "local",
      "label": "основа рациона (Белиз): у части людей ≈30% питания 4700–4000 лет назад, после 4000 — больше 70%",
      "time": {
        "from": -2750,
        "to": -2050,
        "dating": "approx"
      },
      "evidence": "isotopes",
      "sources": [
        {
          "ref": "kennett2020",
          "loc": "аннотация"
        }
      ]
    },
    {
      "id": "meso_staple_other",
      "region": "meso",
      "crop": "кукуруза",
      "kind": "staple",
      "origin": "local",